{
  "schema": "gate_ai_response.v1",
  "request_id": "req-0000000000000001",
  "status": "ok",
  "decision_id": "dec-0000000000000001",
  "content": "{\"action\":\"fill\",\"element\":\"n7\",\"text\":\"[REDACTED:PASSWORD#12]\"}",
  "usage": {
    "input_tokens": 120,
    "output_tokens": 30
  },
  "latency_ns": 1200000
}
